"HLSX5160_MNNYYPPPBLCK_OS_CNF","","Branded branded essential strapback branded","http://ballzy.eu/et/product/branded-branded-essential-strapback-branded-hlsx5160-mnnyypppblck-os-cnf","https://o.cropink.com/i/p-i/f897bf6d-aa69-41bd-b9a3-cb5b57a5d327","","Spordiriided ballzy veebipoest. Vaata lähemalt ballzy.eu.","Men's Hats","24.00 EUR","10.00 EUR","Mitchell &amp; Ness;Black;Basketball;in stock;Yes;Mitchell and Ness;Male","","","","","","","","",""
"SMJY4205_DNU06AIVASBL_L_CNF","","Nba alt. jersey nuggets 2006 allen iverson","http://ballzy.eu/et/product/nba-alt-jersey-nuggets-2006-allen-iverson-smjy4205-dnu06aivasbl-l-cnf","https://o.cropink.com/i/p-i/b57ba32c-d4d7-4f79-bcda-1198d2eafe72","","Spordiriided ballzy veebipoest. Vaata lähemalt ballzy.eu.","Men's Tees","144.00 EUR","59.00 EUR","Mitchell &amp; Ness;Blue;Basketball;in stock;Yes;Mitchell and Ness;Male","","","","","","","","",""
"SMJYGS18150_CBUBLCK95DRD_L_CNF","","Nba swingman alternate jersey bulls 1995 dennis rodman","http://ballzy.eu/et/product/nba-swingman-alternate-jersey-bulls-1995-dennis-rodman-smjygs18150-cbublck95drd-l-cnf","https://o.cropink.com/i/p-i/4295ed42-e743-497e-b60a-fbc65ffe08d2","","Spordiriided ballzy veebipoest. Vaata lähemalt ballzy.eu.","Men's Tees","144.00 EUR","54.00 EUR","Mitchell &amp; Ness;Black;Basketball;in stock;Yes;Mitchell and Ness;Male","","","","","","","","",""
"DX5089_010_L_CNF","","U nk nsw everyday essential cr","http://ballzy.eu/et/product/u-nk-nsw-everyday-essential-cr-dx5089-010-l-cnf","https://o.cropink.com/i/p-i/37d29809-8584-426c-9265-992feee90486","","<html><body><p> pehmed sokid crew cutis&hellip; nike sportsweari sokkidega paned oma parima jala ette. need on valmistatud pehmest, venivast kangast ja mõeldud igapäevaseks kandmiseks ning on vastupidavad, hingavad ja eriti mugavad. see toode on valmistatud vähemalt 75% ulatuses ümbertöödeldud polüesterkiududest&hellip; toote omadused: dri-fit tehnoloogia aitab hoida jalad kuivana ja mugavalt&hellip; tugevdatud kanna ja varbaosa tagavad vastupidavuse&hellip; strateegiliselt paigutatud võrk lisab Vaata lähemalt ballzy.eu.","Men's Socks","23.00 EUR","","Nike;Black;Basketball;in stock;No;Nike;Male|Female","","","","","","","","",""
"DX4985_700_10_CNF","","Zoom freak 5","http://ballzy.eu/et/product/zoom-freak-5-dx4985-700-10-cnf","https://o.cropink.com/i/p-i/8e1c50f5-19c1-4f37-b9d6-94b410b65896","","<html><body><p> giannise sisemine mootor töötab sügavalt sees, mistõttu on vaja kinga, mis suudab kasutada tema supervõimeid. sisesta freak 5. hämmastava kiirusega, mis tagab ülikiired esimesed sammud, täidetuna sellise vedrustatud pehmendusega, mis suudab vastu pidada kogu mängule, laseb tema allkirjastatud kinga sul tunda end nagu kreeka freak. lõhkuge oma vastasest mööda teel ääreni, samal ajal jäädes kinni kiirete pallikaitsjatega, kui kaitsepositsioon otsustab mängu&hellip; toote omadused:  Vaata lähemalt ballzy.eu.","Men's Basketball Shoes","154.00 EUR","79.00 EUR","Nike;Yellow;Basketball;in stock;Yes;Nike;Male","","","","","","","","",""
"FD2335_106_10_CNF","","Jordan one take 5","http://ballzy.eu/et/product/jordan-one-take-5-fd2335-106-10-cnf","https://o.cropink.com/i/p-i/8f5d1525-c76a-43ec-8477-876487bb6e83","","<html><body><p> kiirenda, pange, tulistage, lööge - ja siis korrake. russell westbrooki uusim jalanõu on siin, et aidata sinu kiirusmängu, aidates sul jääda peatumatuks rünnakul. välimine silmapael ja ümbritsev varbaosa lisavad väljakul kaitset, samas kui energiat tagastav zoom air pehmendus esijalal hoiab teid 1. kuni 4. palli vajutamas: tunda end mängimise ajal toetatuna ja turvaliselt, kuna disain seab väljakul esikohale ohjeldamise… zoom air üksus esijalas on ülevalt koormatud, tuues reageer Vaata lähemalt ballzy.eu.","Men's Basketball Shoes","109.00 EUR","54.00 EUR","Jordan;White;Basketball;in stock;Yes;Jordan;Male","","","","","","","","",""
"IE7799_8_CNF","","D.o.n. issue 5","http://ballzy.eu/et/product/d-o-n-issue-5-ie7799-8-cnf","https://o.cropink.com/i/p-i/fe4b065b-d90c-4df1-81ea-d9f8e978590d","","<html><body><p> alates hetkest, mil ta esimest korda kõnniteele astus, on donovan mitchell olnud mängu muutja, ja see on jätkunud isegi siis, kui tema mäng on kasvanud ja arenenud. need d.o.n. issue 5 signatuurkingad adidas basketballilt jätkavad spida väljakul tegutseva isiksuse ja tema väljakuvälise sotsiaalse aktiivsuse arendamist. need korvpallitrennised, millel on ülikerge lightstrike-välipõhi ja ainulaadne kummist välistald, millel on kõrgendatud tõmbemuster, aitavad sul domineerida mängus Vaata lähemalt ballzy.eu.","Men's Basketball Shoes","129.00 EUR","59.00 EUR","adidas Performance;White;Basketball;in stock;Yes;adidas Performance;Male","","","","","","","","",""
"DX5359_200_3.5Y_CNF","","Jordan tatum 1 gs","http://ballzy.eu/et/product/jordan-tatum-1-gs-dx5359-200-3-5y-cnf","https://o.cropink.com/i/p-i/06192f7d-a8f5-4929-ba54-ddaa97967b28","","Spordiriided ballzy veebipoest. Vaata lähemalt ballzy.eu.","Kids' Basketball Shoes","99.00 EUR","49.00 EUR","Jordan;Beež;Basketball;in stock;Yes;Jordan;Children","","","","","","","","",""
"FJ4241_001_10_CNF","","Ja 1 asw","http://ballzy.eu/et/product/ja-1-asw-fj4241-001-10-cnf","https://o.cropink.com/i/p-i/8fd549ad-5256-467f-b72a-21cf5ef252c4","","Spordiriided ballzy veebipoest. Vaata lähemalt ballzy.eu.","Men's Basketball Shoes","169.00 EUR","84.00 EUR","Nike;Multicolored;Basketball;in stock;Yes;Nike;Male","","","","","","","","",""
"FN1714_040_10_CNF","","Jordan zion 3 se","http://ballzy.eu/et/product/jordan-zion-3-se-fn1714-040-10-cnf","https://o.cropink.com/i/p-i/6c98225c-60dc-4a9e-af79-182375df66b7","","<html><body><p> zioni kolmas allkirja kinga tähistab pühendumust, mida ta oma ainulaadse mängu loomisele pühendab. see on pakitud väljakule sobiva tehnoloogiaga ja mõeldud pallijatele, kes on nii maa kui ka õhu meistrid. jää madalale ja piiritletud, plahvata taevasse, koge pehmendusega tagasipöördumist maa peale. zion 3 aitab sind kinni hoida - nii et saad lennata omal moel&hellip; tooteomadused: küljelt küljele, vasakult paremale. härmakaarjas haardumine välistallal aitab sul igal sammul väljak Vaata lähemalt ballzy.eu.","Men's Basketball Shoes","199.00 EUR","89.00 EUR","Jordan;White;Basketball;in stock;Yes;Jordan;Male","","","","","","","","",""
"FV3945_700_10_CNF","","W air jordan xxxviii low h","http://ballzy.eu/et/product/w-air-jordan-xxxviii-low-h-fv3945-700-10-cnf","https://o.cropink.com/i/p-i/fd11a7c4-9cf8-4904-a7c8-2ce08fc9426d","","Spordiriided ballzy veebipoest. Vaata lähemalt ballzy.eu.","Women's Basketball Shoes","229.00 EUR","109.00 EUR","Jordan;Orange;Basketball;in stock;Yes;Jordan;Female","","","","","","","","",""
"E1025_B_2009_CNF","","2pp star chevron double stripe long crew","http://ballzy.eu/et/product/2pp-star-chevron-double-stripe-long-crew-e1025-b-2009-cnf","https://o.cropink.com/i/p-i/082fbf36-2439-44bf-81e6-18a9e9d6bb40","","Spordiriided ballzy veebipoest. Vaata lähemalt ballzy.eu.","Men's Socks","9.00 EUR","5.00 EUR","Converse;Black;Basketball;in stock;Yes;Converse;Male","","","","","","","","",""
"E1025_W_2009_CNF","","2pp star chevron double stripe long crew","http://ballzy.eu/et/product/2pp-star-chevron-double-stripe-long-crew-e1025-w-2009-cnf","https://o.cropink.com/i/p-i/de2d8c5e-84bd-41e5-b952-efdf3a1238cf","","Spordiriided ballzy veebipoest. Vaata lähemalt ballzy.eu.","Men's Socks","9.00 EUR","5.00 EUR","Converse;White;Basketball;in stock;Yes;Converse;Male","","","","","","","","",""
"E1028_W_2009_CNF","","2pp all star double stripe anklet","http://ballzy.eu/et/product/2pp-all-star-double-stripe-anklet-e1028-w-2009-cnf","https://o.cropink.com/i/p-i/cabf612b-f632-4c40-ab41-84ecf23cd34e","","Spordiriided ballzy veebipoest. Vaata lähemalt ballzy.eu.","Women's Socks","7.00 EUR","5.00 EUR","Converse;White;Basketball;in stock;Yes;Converse;Female","","","","","","","","",""
"E726_H_3000_CNF","","3pp converse men classic star chevron crew","http://ballzy.eu/et/product/3pp-converse-men-classic-star-chevron-crew-e726-h-3000-cnf","https://o.cropink.com/i/p-i/e595056b-8795-461e-9986-caf1418918ea","","Spordiriided ballzy veebipoest. Vaata lähemalt ballzy.eu.","Men's Socks","14.00 EUR","9.00 EUR","Converse;Gray;Basketball;in stock;Yes;Converse;Male","","","","","","","","",""
"E746_B_3009_CNF","","3pp converse star chevron logo short quarter","http://ballzy.eu/et/product/3pp-converse-star-chevron-logo-short-quarter-e746-b-3009-cnf","https://o.cropink.com/i/p-i/7eea7f18-ff27-4da1-8264-3e218812767d","","Spordiriided ballzy veebipoest. Vaata lähemalt ballzy.eu.","Men's Socks","14.00 EUR","9.00 EUR","Converse;Black;Basketball;in stock;Yes;Converse;Male","","","","","","","","",""
"E746_W_3009_CNF","","3pp converse star chevron logo short quarter","http://ballzy.eu/et/product/3pp-converse-star-chevron-logo-short-quarter-e746-w-3009-cnf","https://o.cropink.com/i/p-i/cc7af2ac-ce17-4d12-ba63-025cff903970","","Spordiriided ballzy veebipoest. Vaata lähemalt ballzy.eu.","Men's Socks","9.00 EUR","6.00 EUR","Converse;White;Basketball;in stock;Yes;Converse;Male","","","","","","","","",""
"IE2706_8_CNF","","Trae young 3","http://ballzy.eu/et/product/trae-young-3-ie2706-8-cnf","https://o.cropink.com/i/p-i/5bb45f61-443e-4367-a5e2-a9c054de24b2","","<html><body><p> valmistuge järgmiseks. trae youngi ja adidas basketballi allkirjastatud kingade uusversioon on suunatud mängu tulevikule. trae unikaalset välimust, publikut haaravat bravuuri ja ekspressiivset, futuristlikku mängustiili tähistavad kingad on loodud optimeeritud liikumise ja stabiilsuse jaoks, mis on kaks trae mängu elementi, mis on tõstnud ta superstaari staatusesse. vahepealne tald tagab, et kõige plahvatusohtlikumad liigutused saavad toimuda tippkiirusel, samas kui kummist välis Vaata lähemalt ballzy.eu.","Men's Basketball Shoes","149.00 EUR","79.00 EUR","adidas Performance;Orange;Basketball;in stock;Yes;adidas Performance;Male","","","","","","","","",""
"DN2022_015_L_CNF","","Sas mnk df swgmn jsy icn 22","http://ballzy.eu/et/product/sas-mnk-df-swgmn-jsy-icn-22-dn2022-015-l-cnf","https://o.cropink.com/i/p-i/0266b482-ff51-459e-9ce0-1bc3f301b2d9","","<html><body><p> igal meeskonnal on oma tõelised värvid, eksimatu identiteet, mis eristab seda ülejäänud liigast. see san antonio spurs´i trikoo on inspireeritud sellest, mida profid kannavad kõvaplatsil, alates meeskonna detailidest kuni kerge ja higistavani võrkuni. see aitab hoida sind kuivana ja jahedana nii väljakul kui ka väljaspool seda, kui esindad oma lemmikmängijat ja mängu, mida armastad&hellip; toote omadused: nike dri-fit tehnoloogia viib higi nahast eemale, et see aurustuks kiiremin Vaata lähemalt ballzy.eu.","Men's Tees","119.00 EUR","","Nike;Black;Basketball;in stock;No;Nike;Male","","","","","","","","",""
"DO9543_014_L_CNF","","Sas mnk df swgmn jsy stm 22","http://ballzy.eu/et/product/sas-mnk-df-swgmn-jsy-stm-22-do9543-014-l-cnf","https://o.cropink.com/i/p-i/49588eda-568e-441e-ac26-980b93fe1631","","<html><body><p> emuleeri oma lemmikmängijat selles san antonio spursi trikotis, mis on fännide lemmik, mille logo ja kujundus vastab sellele, mida kannavad profid väljakul. lisaks sellele on selles hingav võrk koos higi ärajuhtiva tehnoloogiaga, mis aitab sind hoida jahedana ja kuivana, olenemata sellest, kas oled väljakul või lihtsalt linnas vabalt liikumas&hellip; toote omadused: dri-fit tehnoloogia juhib higi nahast eemale, et see aurustuks kiiremini, aidates sul jääda kuivaks ja mugavaks&hel Vaata lähemalt ballzy.eu.","Men's Tees","119.00 EUR","79.00 EUR","Nike;Black;Basketball;in stock;Yes;Nike;Male","","","","","","","","",""
"IE7881_3.5_CNF","","Trae young 3 j","http://ballzy.eu/et/product/trae-young-3-j-ie7881-3-5-cnf","https://o.cropink.com/i/p-i/b41fe4fa-6c9a-483c-aa67-c6c1d765d087","","<html><body><p> valmistuge järgmiseks. trae youngi ja adidas basketballi signatuur-trennjalatsite juunioride versioon on suunatud mängu tulevikule. trae unikaalset välimust, publikut haaravat bravuuri ja ekspressiivset, futuristlikku mängustiili tähistavad kingad on loodud optimeeritud liikumise ja stabiilsuse jaoks, mis on kaks trae mängu elementi, mis on tõstnud ta superstaari staatusesse. vahepealne tald tagab, et kõige plahvatusohtlikumad liigutused saavad toimuda tippkiirusel, samas kui kum Vaata lähemalt ballzy.eu.","Kids' Basketball Shoes","129.00 EUR","64.00 EUR","adidas Performance;Multicolored;Basketball;in stock;Yes;adidas Performance;Children","","","","","","","","",""
"30983702_6_CNF","","Scoot zeros","http://ballzy.eu/et/product/scoot-zeros-30983702-6-cnf","https://o.cropink.com/i/p-i/4acdbeea-0e5f-468f-855b-128f4ddfae5d","","Spordiriided ballzy veebipoest. Vaata lähemalt ballzy.eu.","Men's Basketball Shoes","104.00 EUR","54.00 EUR","Puma;Multicolored;Basketball;in stock;Yes;Puma;Male","","","","","","","","",""
"30984701_5.5_CNF","","Pl mb.03","http://ballzy.eu/et/product/pl-mb-03-30984701-5-5-cnf","https://o.cropink.com/i/p-i/65313fe6-9cc7-4373-ab42-7349ebd619e7","","Spordiriided ballzy veebipoest. Vaata lähemalt ballzy.eu.","Men's Basketball Shoes","149.00 EUR","69.00 EUR","Puma;Yellow;Basketball;in stock;Yes;Puma;Male","","","","","","","","",""
"37990401_7_CNF","","Mb.03","http://ballzy.eu/et/product/mb-03-37990401-7-cnf","https://o.cropink.com/i/p-i/b26319b6-fbe5-4575-a23c-cfdb8b478c69","","Spordiriided ballzy veebipoest. Vaata lähemalt ballzy.eu.","Men's Basketball Shoes","134.00 EUR","64.00 EUR","Puma;Multicolored;Basketball;in stock;Yes;Puma;Male","","","","","","","","",""
"DX9632_916_L_CNF","","U j ed cush poly crew 3pr 144","http://ballzy.eu/et/product/u-j-ed-cush-poly-crew-3pr-144-dx9632-916-l-cnf","https://o.cropink.com/i/p-i/20a7b55e-4ccf-4035-ab14-2c8c96d04f8f","","<html><body><p> sinu igapäevased, pehmed ja usaldusväärsed sokid. higi ärajuhtiv tehnoloogia hoiab jalad jahedad ja kuivad, samas kui mugav kaarepael toetab&hellip; tooteomadused: pehmendus esijala ja kanna all aitab pehmendada treeningu mõju&hellip; vöörihma ümbritsev rihm on mugav ja toetav&hellip; hingav kudumismuster ülaosas lisab ventilatsiooni&hellip; tugevdatud kanna ja varbaosa on valmistatud kestma&hellip; toote omaduste alapealkirjad: tugevdatud kanna ja varbaosa on valmistatud kestma& Vaata lähemalt ballzy.eu.","Kids' Socks","24.00 EUR","12.00 EUR","Jordan;Multicolored;Basketball;in stock;Yes;Jordan;Male|Female|Children","","","","","","","","",""
"FJ6823_100_L_CNF","","U j everyday essentials crew 1","http://ballzy.eu/et/product/u-j-everyday-essentials-crew-1-fj6823-100-l-cnf","https://o.cropink.com/i/p-i/8923e7ca-41ea-470a-8e16-b31e06d7d92b","","<html><body><p> pehme ja veniv disain, higi ärajuhtiv tehnoloogia ja toetav rihm teevad jordan everyday essentials crew sokid just selliseks - hädavajalikuks. kas sa'lööd jõusaali või jooksed asju, tee seda mugavalt ja stiilselt&hellip; toote omadused: nike dri-fit tehnoloogia viib higi nahast eemale, et see aurustuks kiiremini, aidates sul jääda kuivaks ja mugavaks&hellip; kaare ümber olev rihm on mugav ja toetav&hellip; toote omaduste alapealkirjad: tootedetailid: 96% polüester/4% elastaani. m Vaata lähemalt ballzy.eu.","Kids' Socks","24.00 EUR","12.00 EUR","Jordan;White;Basketball;in stock;Yes;Jordan;Male|Female|Children","","","","","","","","",""
"DZ1551_900_L_CNF","","U nk ed perf csh crw 2p 168 ud","http://ballzy.eu/et/product/u-nk-ed-perf-csh-crw-2p-168-ud-dz1551-900-l-cnf","https://o.cropink.com/i/p-i/c0118d0b-bc97-44e5-a779-a29aa2e7322a","","<html><body><p> kõrgendatud twill-muster, värvitu lõng ja vööndiline pehmendus tähendavad puhast jõudlust, olgu see siis igapäevane töö või pikk matk. ja me ei ole unustanud olulisi asju: kaare ümber olev rihm hoiab teie sokid mugavalt ja toetavalt, samas kui ribid ülaosas aitavad neil püsti püsida&hellip; toote üksikasjad: 64% puuvill / 34% polüester / 2% elastaani. masinpesu. imporditud. </p></body></html> Vaata lähemalt ballzy.eu.","Kids' Socks","24.00 EUR","","Nike;Black;Basketball;in stock;No;Nike;Male|Female|Children","","","","","","","","",""
"DZ7533_102_10_CNF","","Giannis immortality 3","http://ballzy.eu/et/product/giannis-immortality-3-dz7533-102-10-cnf","https://o.cropink.com/i/p-i/174f2f23-3f8e-40df-b403-81735ac3f373","","<html><body><p> kuidas soovite, et teie mäng jääks meelde? säilita oma koht suurkujude seas, nagu giannis, giannis immortality 3. mõistlikult valmistatud tänapäevase kiire ja positsioonita mängu jaoks, on see eelmisest iteratsioonist pehmem, millel on spetsiifiline tõmbemuster, mis sobib ideaalselt täiusliku eurosammu tõmbamiseks teel au&hellip; toote omadused: näed välistalla keskel lõhestatud sooned? need annavad sulle rohkem paindlikkust, et muuta küljelt küljele liikumine, nagu näiteks euro  Vaata lähemalt ballzy.eu.","Men's Basketball Shoes","104.00 EUR","59.00 EUR","Nike;White;Basketball;in stock;Yes;Nike;Male","","","","","","","","",""
"FB2239_800_10_CNF","","Lebron witness viii","http://ballzy.eu/et/product/lebron-witness-viii-fb2239-800-10-cnf","https://o.cropink.com/i/p-i/4525ffe1-d72e-49b5-a306-3955c96f20e7","","<html><body><p> kui sa astud lavale, siis millist esinemist sa tahad näidata? lõpeta show nendes lebron witness 8´s ja anna teada, et sinu elegantsil ja täismõõtmelistel oskustel ei ole piire. see liibuv ja julgelt vormitud kinga pakub stabiilsust, kui plahvatad ja pehmet maandumist, kui tuled tagasi maapinnale, võimaldades kingpins nagu sina ja lebron siduda, pidurdada ja poltida põhijoonelt põhijoonele… toote omadused: see kinga pakub stabiilsust, kui plahvatad, ja pehmet maandumist, kui tuled Vaata lähemalt ballzy.eu.","Men's Basketball Shoes","149.00 EUR","69.00 EUR","Nike;Orange;Basketball;in stock;Yes;Nike;Male","","","","","","","","",""
"SX4926_901_L_CNF","","U nk cush qtr 3pr-value 108","http://ballzy.eu/et/product/u-nk-cush-qtr-3pr-value-108-sx4926-901-l-cnf","https://o.cropink.com/i/p-i/c7c5628c-ab7a-44d6-a2f3-7a0dc7dd1898","","<html><body><p> kergest materjalist valmistatud nike sokid pakuvad püsivat mugavust ja mugavat disaini, mis toetab sinu treeningut algusest lõpuni&hellip; toote omadused: kerge konstruktsioon pakub vähem mahtu&hellip; kaaritugi loob mugava tunde&hellip; tugevdatud kanna ja varbaosa tagavad vastupidavuse kõrge kulumisastmega piirkondades&hellip; toote omaduste alapealkirjad: tootedetailid: 75% puuvilla/18% polüester/6% nailon/1% elastaani. masinpesu. imporditud. </p></body></html> Vaata lähemalt ballzy.eu.","Kids' Socks","15.00 EUR","12.00 EUR","Nike;Multicolored;Basketball;in stock;Yes;Nike;Male|Female|Children","","","","","","","","",""
"FPHD6293_CBUYYPPPSCAR_L_CNF","","Nba head coach hoodie bulls","http://ballzy.eu/et/product/nba-head-coach-hoodie-bulls-fphd6293-cbuyypppscar-l-cnf","https://o.cropink.com/i/p-i/e376e29f-e83b-4a51-89fc-d4d380ea62e8","","Spordiriided ballzy veebipoest. Vaata lähemalt ballzy.eu.","Men's Hoodies","99.00 EUR","44.00 EUR","Mitchell &amp; Ness;Red;Basketball;in stock;Yes;Mitchell and Ness;Male","","","","","","","","",""
"FB5375_133_M_L_CNF","","U nk club cap u cb cord l","http://ballzy.eu/et/product/u-nk-club-cap-u-cb-cord-l-fb5375-133-m-l-cnf","https://o.cropink.com/i/p-i/35771076-d1e7-4e3a-87df-d8409c6b9779","","<html><body><p> see klassikalise stiiliga keskmise sügavusega müts nike club cap on mõeldud igaks juhuks ja pakub igapäevast mugavust, mida saab nii riietada kui ka vähendada. pehme ja struktureerimata, sellel on lihtsaks stiiliks eelkumerdatud nokkmüts. reguleeritav tagarihm võimaldab leida õige istuvuse, mis tagab püsiva mugavuse&hellip; toote omadused: nike clubi mütsidel on keskmise sügavusega disain klassikalise stiiliga, mis on piisavalt mitmekülgne igaks juhuks&hellip; corduroy tundub peh Vaata lähemalt ballzy.eu.","Kids' Hats","34.00 EUR","17.00 EUR","Nike;White;Basketball;in stock;Yes;Nike;Male|Female|Children","","","","","","","","",""
"DV3869_002_3.5Y_CNF","","Jordan zion 3 gs","http://ballzy.eu/et/product/jordan-zion-3-gs-dv3869-002-3-5y-cnf","https://o.cropink.com/i/p-i/56a0c085-fb09-4419-afb0-ff99c03e3e1a","","<html><body><p> zioni kolmas allkirja kinga tähistab pühendumust, mida ta oma ainulaadse mängu loomisele pühendab. see on pakitud väljakule sobiva tehnoloogiaga ja mõeldud pallijatele, kes on nii maa kui ka õhu meistrid. jääge madalale ja piiritletud, plahvatage taevasse, pehmendusega tagasi maa peale. zion 3 aitab sind maas hoida - nii et saad lennata omal moel&hellip; tooteomadused: küljelt küljele, vasakult paremale. härmakaarjas haardumine välistallal aitab sul igal sammul väljakul haarduda  Vaata lähemalt ballzy.eu.","Kids' Basketball Shoes","119.00 EUR","59.00 EUR","Jordan;Multicolored;Basketball;in stock;Yes;Jordan;Female|Children","","","","","","","","",""
"FD2338_100_3.5Y_CNF","","Jordan one take 5 gs","http://ballzy.eu/et/product/jordan-one-take-5-gs-fd2338-100-3-5y-cnf","https://o.cropink.com/i/p-i/b841e940-76a2-445f-8245-0d3cbb681908","","<html><body><p> kiirenda, pange, tulistage, lööge - ja siis korrake. russell westbrooki uusim jalanõu on siin, et aidata teie kiirusmängu, et te oleksite murdmisel peatamatu. külgmised silmapaelad ja ümbermähitud varbaosa aitavad sul end väljakul kindlalt tunda. jalgade all on esijalas energiat tagastav zoom air pehmendus, nii et saate hoida sinkin' 'em esimesest kuni neljanda&hellip; toote omadused: pealne, silmapael ja ümbermähitud varbaosa koos aitavad anda sulle väljakul vajalikku kaitset, m Vaata lähemalt ballzy.eu.","Kids' Basketball Shoes","89.00 EUR","44.00 EUR","Jordan;Gray;Basketball;in stock;Yes;Jordan;Female|Children","","","","","","","","",""
"FJ1566_300_10_CNF","","Zm lebron nxxt gen ampd","http://ballzy.eu/et/product/zm-lebron-nxxt-gen-ampd-fj1566-300-10-cnf","https://o.cropink.com/i/p-i/2d6c955c-527e-4efa-bf22-28305620bf4f","","<html><body><p> olgu sa siis dunkerdusvõistlusele sarnane hüppaja või põhijoonel tiirutav allapoole servi imeline mängija, tunned end lebron nxxt gen´is kiiresti, madalal väljakul ja kindlalt. oleme selle spetsiaalselt kohandanud tänapäeva kiire mängu nõudmistele, et saaksid oma kiirusega igas suunas vastasest ees püsida… toote omadused: multidirectional traction muster on akroni kaart - ood lebron´i juurtele ja linnale, kuhu ta jätkuvalt valab… suur esijalgade air zoom üksus on kaardus, et pain Vaata lähemalt ballzy.eu.","Men's Basketball Shoes","189.00 EUR","89.00 EUR","Nike;Multicolored;Basketball;in stock;Yes;Nike;Male","","","","","","","","",""
"FN4977_400_4.5Y_CNF","","Ja 1 se gs","http://ballzy.eu/et/product/ja-1-se-gs-fn4977-400-4-5y-cnf","https://o.cropink.com/i/p-i/783014f4-8441-4478-bae9-c57ddf3148d6","","Spordiriided ballzy veebipoest. Vaata lähemalt ballzy.eu.","Kids' Basketball Shoes","109.00 EUR","59.00 EUR","Nike;Multicolored;Basketball;in stock;Yes;Nike;Children","","","","","","","","",""
"FJ6459_100_3.5Y_CNF","","Jordan tatum 2 gs","http://ballzy.eu/et/product/jordan-tatum-2-gs-fj6459-100-3-5y-cnf","https://o.cropink.com/i/p-i/e96bb9c7-482c-4dc9-ac34-6fce3d2d0b31","","<html><body><p> enne kõrgeid skoore ja mvp auhindu tuleb teha esimene samm. tatum 2 teeb selle lihtsaks kokkuklapitava kannaga, mis vedrutab tagasi oma kohale, kui oled sisse astunud. ja väljakul aitavad kohanduv sobivus ja tõhus konstruktsioon sul jääda kergelt jalule, kuni kuuled seda suminat&hellip; tooteomadused: tatum 2 raam on talla alla ja pealsele mähitud, et toetada sinu madalal maa peal mängimist, mis lisab pidamist&hellip; sa'oled väljakul alati liikvel. see'on koht, kus kummist välis Vaata lähemalt ballzy.eu.","Kids' Basketball Shoes","99.00 EUR","49.00 EUR","Jordan;White;Basketball;in stock;Yes;Jordan;Children","","","","","","","","",""
"30983901_7_CNF","","Scoot zeros","http://ballzy.eu/et/product/scoot-zeros-30983901-7-cnf","https://o.cropink.com/i/p-i/ffbadf8a-97e6-4a27-b10a-e13df821d95b","","Spordiriided ballzy veebipoest. Vaata lähemalt ballzy.eu.","Men's Basketball Shoes","99.00 EUR","49.00 EUR","Puma;White;Basketball;in stock;Yes;Puma;Male","","","","","","","","",""
"31035401_6.5_CNF","","Scoot zeros","http://ballzy.eu/et/product/scoot-zeros-31035401-6-5-cnf","https://o.cropink.com/i/p-i/c2d65ad2-358f-4b2f-ba11-e0de3e28fd58","","Spordiriided ballzy veebipoest. Vaata lähemalt ballzy.eu.","Men's Basketball Shoes","99.00 EUR","49.00 EUR","Puma;Multicolored;Basketball;in stock;Yes;Puma;Male","","","","","","","","",""
"BBKLSBR4_85_CNF","","The kawhi iv","http://ballzy.eu/et/product/the-kawhi-iv-bbklsbr4-85-cnf","https://o.cropink.com/i/p-i/5d6ab920-2678-45e8-a56c-417330192ebe","","Spordiriided ballzy veebipoest. Vaata lähemalt ballzy.eu.","Men's Basketball Shoes","184.00 EUR","89.00 EUR","New Balance;White;Basketball;in stock;Yes;New Balance;Male","","","","","","","","",""
"DX4985_402_8.5_CNF","","Zoom freak 5","http://ballzy.eu/et/product/zoom-freak-5-dx4985-402-8-5-cnf","https://o.cropink.com/i/p-i/096b5b0a-8847-4e68-bf7e-66cc51b4bc2b","","<html><body><p> giannise sisemine mootor töötab sügavalt sees, mistõttu on vaja kinga, mis suudab kasutada tema supervõimeid. sisesta freak 5. hämmastava kiirusega, mis tagab ülikiired esimesed sammud, täidetuna sellise vedrustatud pehmendusega, mis suudab vastu pidada kogu mängule, laseb tema allkirjastatud kinga sul tunda end nagu kreeka freak. lõhkuge oma vastasest mööda teel ääreni, samal ajal jäädes kinni kiirete pallikaitsjatega, kui kaitsepositsioon otsustab mängu… toote omadused: esijala Vaata lähemalt ballzy.eu.","Men's Basketball Shoes","169.00 EUR","79.00 EUR","Nike;Blue;Basketball;in stock;Yes;Nike;Male","","","","","","","","",""
