"ID","ID2","Item title","Final URL","Image URL","Item subtitle","Item description","Item category","Price","Sale price","Contextual keywords","Item address","Tracking template","Custom parameter","Final mobile URL","Android app link","iOS app link","iOS app store ID","Formatted price","Formatted sale price"
"SX7622_013_S_CNF","","U nk elite crew 132","http://ballzy.eu/et/product/u-nk-elite-crew-132-sx7622-013-s-cnf","https://o.cropink.com/i/p-i/d75202cf-5885-4a9d-ae93-034dc8d39ead","","Nike elite crew' korvpallisokid toetavad tänu võlviribale jalga ja pehmendused strateegilistes kohtades summutavad põrutust, kui sa üle väljaku jooksed. dri-fit-i tehnoloogia aitab sul püsida kuiv ja tunda end mugavalt. Vaata lähemalt ballzy.eu.","Men's Socks","14.00 EUR","","Nike;Black;Basketball;in stock;No;Nike;Male|Female|Children","","","","","","","","",""
"SX7622_100_S_CNF","","U nk elite crew","http://ballzy.eu/et/product/u-nk-elite-crew-sx7622-100-s-cnf","https://o.cropink.com/i/p-i/7c8c9de8-3eed-4775-8059-8e781e8cecfe","","Nike elite crew' korvpallisokid toetavad tänu võlviribale jalga ja pehmendused strateegilistes kohtades summutavad põrutust, kui sa üle väljaku jooksed. dri-fit-i tehnoloogia aitab sul püsida kuiv ja tunda end mugavalt. Vaata lähemalt ballzy.eu.","Men's Socks","19.00 EUR","","Nike;White;Basketball;in stock;No;Nike;Male|Female|Children","","","","","","","","",""
"6446B_BLK_S_CNF","","Mcd extended leg sleeves","http://ballzy.eu/et/product/mcd-extended-leg-sleeves-6446b-blk-s-cnf","https://o.cropink.com/i/p-i/4ca2d83b-77b4-43ef-8d4b-3e4df420ce1f","","Leg sleeve featuring 9mm hex™ technology is a favorite among pro and collegiate players Vaata lähemalt ballzy.eu.","Kids' Accessories","49.00 EUR","29.00 EUR","Mcdavid;Black;Basketball;in stock;Yes;Mcdavid;Male|Female|Children","","","","","","","","",""
"300207401_S_CNF","","Spalding parka","http://ballzy.eu/et/product/spalding-parka-300207401-s-cnf","https://o.cropink.com/i/p-i/f966a295-dadd-4eb3-b5aa-db0c0e5625bb","","Spordiriided ballzy veebipoest. Vaata lähemalt ballzy.eu.","Men's Jackets","140.00 EUR","","Spalding;Black;Basketball;in stock;No;Spalding;Male","","","","","","","","",""
"6500W_WHI_S_CNF","","Mcd hex shooter arm sleeve","http://ballzy.eu/et/product/mcd-hex-shooter-arm-sleeve-6500w-whi-s-cnf","https://o.cropink.com/i/p-i/1d70d0c0-8511-485f-8449-2da1f11e776d","","Arm compression maintains muscle warmth and prevents abrasions and scratches Vaata lähemalt ballzy.eu.","Kids' Accessories","24.00 EUR","14.00 EUR","Mcdavid;White;Basketball;in stock;Yes;Mcdavid;Male|Female|Children","","","","","","","","",""
"SX7667_100_S_CNF","","U nk everyday cush ankle 3pr","http://ballzy.eu/et/product/u-nk-everyday-cush-ankle-3pr-sx7667-100-s-cnf","https://o.cropink.com/i/p-i/c6da3aa7-3e3e-4ea9-af1d-39004a8007b7","","mugavus ja toestus./>läbi oma treeningud nike everyday cushioned socks sokkidega. paks terry tallaosa annab sulle lisamugavust jalgade harjutuste ja tõstete jaoks, samal ajal kui võlvi ümber on liibuv ja toetav riba ekstrateotuse jaoks.dri-fit tehnoloogia aitab hoida su jalad kuivana ja mugavana.paks terry tallaosa pakub mugavust ja põrutuse neeldumist.võlvi ümber olev riba annab toetava tunde.1/4-pikkusega lõige katab su pahkluu. Vaata lähemalt ballzy.eu.","Men's Socks","19.00 EUR","","Nike;White;Basketball;in stock;No;Nike;Male|Female|Children","","","","","","","","",""
"SX5854_010_S_CNF","","U j flight crew","http://ballzy.eu/et/product/u-j-flight-crew-sx5854-010-s-cnf","https://o.cropink.com/i/p-i/4a4428cd-2529-4737-849c-54ec83c3910e","","<html><body><p> sneaker's best friend&hellip; jordan flight crew sokid toovad tulemusliku korvpalli eelised sinu sokisahtlisse. need on mugavad, venivad ja pehmed, sisseehitatud pehmendusega ja hingavusega. higi ärajuhtiv tehnoloogia aitab hoida jalad liikvel olles mugavalt &hellip; toote omadused: pehme, veniv trikookangas pakub mugavat ja mugavat istuvust&hellip; sissekootud pehmendus aitab jalga pehmendada olulistes kohtades&hellip; sissekootud võrk tagab hingavuse&hellip; kaaristuge venib ja Vaata lähemalt ballzy.eu.","Men's Socks","17.00 EUR","12.00 EUR","Jordan;Black;Basketball;in stock;Yes;Jordan;Male","","","","","","","","",""
"SK0110_010_S_CNF","","U nk nsw evry essential ankle","http://ballzy.eu/et/product/u-nk-nsw-evry-essential-ankle-sk0110-010-s-cnf","https://o.cropink.com/i/p-i/4b7eda76-6f74-41fd-b0ef-8deeadc08bfa","","Spordiriided ballzy veebipoest. Vaata lähemalt ballzy.eu.","Men's Socks","17.00 EUR","10.00 EUR","Nike;Black;Basketball;in stock;Yes;Nike;Male|Female|Children","","","","","","","","",""
"AT3383_100_S_CNF","","M np dry tght 3qt bball","http://ballzy.eu/et/product/m-np-dry-tght-3qt-bball-at3383-100-s-cnf","https://o.cropink.com/i/p-i/bf50b4b5-a359-433a-8038-3ef1408956f2","","Spordiriided ballzy veebipoest. Vaata lähemalt ballzy.eu.","Men's Leggings","44.00 EUR","19.00 EUR","Nike;White;Basketball;in stock;Yes;Nike;Male","","","","","","","","",""
"SK0110_101_S_CNF","","U nk nsw evry essential ankle","http://ballzy.eu/et/product/u-nk-nsw-evry-essential-ankle-sk0110-101-s-cnf","https://o.cropink.com/i/p-i/0993486d-f8f5-4853-b6b4-5c9753539348","","Spordiriided ballzy veebipoest. Vaata lähemalt ballzy.eu.","Men's Socks","17.00 EUR","10.00 EUR","Nike;White;Basketball;in stock;Yes;Nike;Male|Female|Children","","","","","","","","",""
"SX7666_100_M_CNF","","U nk everyday cush crew 6 pairs","http://ballzy.eu/et/product/u-nk-everyday-cush-crew-6-pairs-sx7666-100-m-cnf","https://o.cropink.com/i/p-i/35c1a225-c324-4b50-b0ff-cee70e540a6e","","<html><body><p> mugavus ja tugevus&hellip; nike everyday cushioned sokid annavad jõudu treeningule. paks froteepõhi annab sulle lisamugavust jalaharjutuste ja tõstete tegemiseks, samas kui ribiline kaareriba ümbritseb sinu keskjalga, et tagada toetav tunne&hellip; toote omadused: dri-fit tehnoloogia aitab hoida jalad kuivana ja mugavalt&hellip; paks froteepõhi pakub mugavust ja löögiabi&hellip; ribitud kaareriba pakub toetavat tunnet&hellip; crew-siluett katab pahkluu ja alajäseme&hellip; tooteo Vaata lähemalt ballzy.eu.","Men's Socks","29.00 EUR","","Nike;White;Basketball;in stock;No;Nike;Male|Female|Children","","","","","","","","",""
"SX7589_010_M_CNF","","U jordan crew - nba","http://ballzy.eu/et/product/u-jordan-crew-nba-sx7589-010-m-cnf","https://o.cropink.com/i/p-i/f8045a4f-286b-4ed1-b51a-a9f7e85f5158","","<html><body><p> focused footwork: nba edition&hellip; jordan nba crew sokid pakuvad toetavat istuvust ja tunnetust. ümbritsev kaareriba haarab jalga, samal ajal kui tsooniline pehmendus aitab põrutusi neelata, kui jooksete väljakul&hellip; toote omadused: zonaalne pehmendus aitab absorbeerida lööki&hellip; kaarepael pakub mugavat ja turvalist istuvust&hellip; toote omaduste alapealkirjad: higi eemaldav tehnoloogia aitab sul kuivana ja mugavalt püsida&hellip; toote omaduste alapealkirjad: higi ee Vaata lähemalt ballzy.eu.","Men's Socks","24.00 EUR","","Jordan;Black;Basketball;in stock;No;Jordan;Male|Female|Children","","","","","","","","",""
"8235SCN_CNF","","Net heavy duty","http://ballzy.eu/et/product/net-heavy-duty-8235scn-cnf","https://o.cropink.com/i/p-i/0d6adc32-0aca-4637-9091-74c58499d370","","Spordiriided ballzy veebipoest. Vaata lähemalt ballzy.eu.","Kids' Accessories","11.00 EUR","","Spalding;Multicolored;Basketball;in stock;No;Spalding;Male|Female|Children","","","","","","","","",""
"20955HN_99_XS_CNF","","Hnmky bomber jacket black","http://ballzy.eu/et/product/hnmky-bomber-jacket-black-20955hn-99-xs-cnf","https://o.cropink.com/i/p-i/06cfefaf-43db-4488-890b-db0fc355f60c","","Spordiriided ballzy veebipoest. Vaata lähemalt ballzy.eu.","Men's Jackets","100.00 EUR","","Ballzy Fanwear;Black;Basketball;in stock;No;Ballzy Fanwear;Male|Female|Children","","","","","","","","",""
"CN1719_065_S_CNF","","Chi m nk swgmn jsy ce 20","http://ballzy.eu/et/product/chi-m-nk-swgmn-jsy-ce-20-cn1719-065-s-cnf","https://o.cropink.com/i/p-i/27673a29-8eb5-434f-995d-b4df1cbf8b4f","","Spordiriided ballzy veebipoest. Vaata lähemalt ballzy.eu.","Men's Tees","109.00 EUR","54.00 EUR","Nike;Gray;Basketball;in stock;Yes;Nike;Male","","","","","","","","",""
"BV5635_010_S_CNF","","M np short","http://ballzy.eu/et/product/m-np-short-bv5635-010-s-cnf","https://o.cropink.com/i/p-i/f5929a78-d292-46e4-a45d-47240d21d073","","Spordiriided ballzy veebipoest. Vaata lähemalt ballzy.eu.","Men's Leggings","29.00 EUR","19.00 EUR","Nike;Black;Basketball;in stock;Yes;Nike;Male","","","","","","","","",""
"6446R_RED_S_CNF","","Mcd extended leg sleeves","http://ballzy.eu/et/product/mcd-extended-leg-sleeves-6446r-red-s-cnf","https://o.cropink.com/i/p-i/5a295140-a282-4c3d-ba3f-f406cb28fa3c","","Leg sleeve featuring 9mm hex™ technology is a favorite among pro and collegiate players Vaata lähemalt ballzy.eu.","Kids' Accessories","39.00 EUR","19.00 EUR","Mcdavid;Red;Basketball;in stock;Yes;Mcdavid;Male|Female|Children","","","","","","","","",""
"DD1917_010_S_CNF","","M np df short","http://ballzy.eu/et/product/m-np-df-short-dd1917-010-s-cnf","https://o.cropink.com/i/p-i/502c96b4-2792-4af6-b56e-b1076c4da16e","","<html><body><p> kerge tugevus, tugevus, mis on ette nähtud jõudluseks&hellip; nike pro dri-fit shorts on palju rohkem kui põhikiht, sest need on kergest materjalist, mis hoiab sind kuivana, jahedana ja toetab sind alates soojendusest kuni jahedate treeninguteni. need on valmistatud vähemalt 75% ulatuses taaskasutatud polüesterkiududest, mille veniv disain aitab sul kõige raskemate treeningute või võistluste ajal täiel määral liikuda&hellip; tooteomadused: nike dri-fit tehnoloogia juhib higi keha Vaata lähemalt ballzy.eu.","Men's Leggings","34.00 EUR","24.00 EUR","Nike;Black;Basketball;in stock;Yes;Nike;Male","","","","","","","","",""
"DD1917_068_S_CNF","","M np df short","http://ballzy.eu/et/product/m-np-df-short-dd1917-068-s-cnf","https://o.cropink.com/i/p-i/91d715ed-fc83-4b0a-ab0b-1f9793bce876","","<html><body><p> kerge tugevus, tugevus, mis on ette nähtud jõudluseks&hellip; nike pro dri-fit shorts on palju rohkem kui põhikiht, sest need on kergest materjalist, mis hoiab sind kuivana, jahedana ja toetab sind alates soojendusest kuni jahedate treeninguteni. need on valmistatud vähemalt 75% ulatuses taaskasutatud polüesterkiududest, mille veniv disain aitab sul kõige raskemate treeningute või võistluste ajal täiel määral liikuda&hellip; tooteomadused: nike dri-fit tehnoloogia juhib higi keha Vaata lähemalt ballzy.eu.","Men's Leggings","34.00 EUR","24.00 EUR","Nike;Gray;Basketball;in stock;Yes;Nike;Male","","","","","","","","",""
"DD1917_100_S_CNF","","M np df short","http://ballzy.eu/et/product/m-np-df-short-dd1917-100-s-cnf","https://o.cropink.com/i/p-i/f37e93ee-8778-416e-b6c9-93ba75f6b88b","","<html><body><p> kerge tugevus, tugevus, mis on ette nähtud jõudluseks&hellip; nike pro dri-fit shorts on palju rohkem kui põhikiht, sest need on kergest materjalist, mis hoiab sind kuivana, jahedana ja toetab sind alates soojendusest kuni jahedate treeninguteni. need on valmistatud vähemalt 75% ulatuses taaskasutatud polüesterkiududest, mille veniv disain aitab sul kõige raskemate treeningute või võistluste ajal täiel määral liikuda&hellip; tooteomadused: nike dri-fit tehnoloogia juhib higi keha Vaata lähemalt ballzy.eu.","Men's Leggings","34.00 EUR","19.00 EUR","Nike;White;Basketball;in stock;Yes;Nike;Male","","","","","","","","",""
"DH9077_010_S_CNF","","M j df sprt mesh short","http://ballzy.eu/et/product/m-j-df-sprt-mesh-short-dh9077-010-s-cnf","https://o.cropink.com/i/p-i/5779cb2a-5234-49c6-b998-a4ddad11dc9a","","Spordiriided ballzy veebipoest. Vaata lähemalt ballzy.eu.","Men's Shorts","39.00 EUR","24.00 EUR","Jordan;Black;Basketball;in stock;Yes;Jordan;Male","","","","","","","","",""
"DD1919_010_S_CNF","","M np df 3qt tight","http://ballzy.eu/et/product/m-np-df-3qt-tight-dd1919-010-s-cnf","https://o.cropink.com/i/p-i/9ad97f96-cd9f-473e-9646-9fabdc5a7d41","","<html><body><p> kerge tugevus, tugevus, mis on ette nähtud jõudluseks&hellip; nike pro dri-fit sukkpüksid ümbritsevad sind kerge kangaga, mis aitab sul tunda end kuivana, jahedana ja toetada sind alates soojendusest kuni jahedate treeninguteni. need on valmistatud vähemalt 75% ulatuses taaskasutatud polüesterkiududest, mille veniv disain aitab teil liikuda täie intensiivsusega ka kõige raskemate treeningute või võistluste ajal&hellip; toote omadused: need on valmistatud vähemalt 75% ulatuses taa Vaata lähemalt ballzy.eu.","Men's Leggings","39.00 EUR","","Nike;Black;Basketball;in stock;No;Nike;Male","","","","","","","","",""
"DD1990_100_S_CNF","","M np df tight top ls","http://ballzy.eu/et/product/m-np-df-tight-top-ls-dd1990-100-s-cnf","https://o.cropink.com/i/p-i/fe08d7f3-50f6-498e-8cc4-d3d45f72df22","","lisahingavus just seal, kus seda kõige rohkem vajate./>nike pro dri-fit top ümbritseb teid kerge kangaga, millel hingav materjal piirkondades kus on kõrgem temperatuur, et aidata teil püsida jahedana ja kuivana soojendustest kuni maha jahtumiseni. elastne kangas, mis on valmistatud vähemalt 75% taaskasutatud polüesterkiududestt, pakub tihedat sobivust ja võimaldab kergesti kanda teiste riiete all.integreeritud hingavus - võrkmaterjal selja, külgede ja kaenlaalust Vaata lähemalt ballzy.eu.","Men's Leggings","39.00 EUR","24.00 EUR","Nike;White;Basketball;in stock;Yes;Nike;Male","","","","","","","","",""
"DH5485_601_S_CNF","","U nk everyday ankle 1pk - 144","http://ballzy.eu/et/product/u-nk-everyday-ankle-1pk-144-dh5485-601-s-cnf","https://o.cropink.com/i/p-i/db627b86-bef5-4b35-83d2-a1e846cb728a","","<html><body><p> töötavad välja rõveduse pärast. kombineerides pehmed lõngad higi äravoolava võimsusega, aitavad need narmastatud mansetiga sokid hoida jalad treeningute ajal kuivana ja mugavalt, ohverdamata seejuures stiili&hellip; tooteomadused: dri-fit tehnoloogia aitab hoida jalad kuivana ja mugavalt&hellip; kootud lõngad tunduvad jalgade vastu pehmed&hellip; toote omaduste alajaotused: tootedetailid: 85% polüester/13% nailon/2% elastaani&hellip; masinpesu. imporditud. </p></body></html> Vaata lähemalt ballzy.eu.","Men's Socks","17.00 EUR","7.00 EUR","Nike;Pink;Basketball;in stock;Yes;Nike;Male|Female","","","","","","","","",""
"DH5485_010_S_CNF","","U nk everyday ankle 1pk - 144","http://ballzy.eu/et/product/u-nk-everyday-ankle-1pk-144-dh5485-010-s-cnf","https://o.cropink.com/i/p-i/e9add240-215c-47a7-9253-b5860a3f49df","","<html><body><p> töötavad välja rõveduse pärast. kombineerides pehmed lõngad higi äravoolava võimsusega, aitavad need narmastatud mansetiga sokid hoida jalad treeningute ajal kuivana ja mugavalt, ohverdamata seejuures stiili&hellip; tooteomadused: dri-fit tehnoloogia aitab hoida jalad kuivana ja mugavalt&hellip; kootud lõngad tunduvad jalgade vastu pehmed&hellip; toote omaduste alajaotused: tootedetailid: 85% polüester/13% nailon/2% elastaani&hellip; masinpesu. imporditud. </p></body></html> Vaata lähemalt ballzy.eu.","Men's Socks","17.00 EUR","7.00 EUR","Nike;Black;Basketball;in stock;Yes;Nike;Male|Female","","","","","","","","",""
"DN3314_010_S_CNF","","U nk evryday plus cush footie","http://ballzy.eu/et/product/u-nk-evryday-plus-cush-footie-dn3314-010-s-cnf","https://o.cropink.com/i/p-i/61d88bee-52db-4b4e-93ed-a66a5de8b8f2","","Spordiriided ballzy veebipoest. Vaata lähemalt ballzy.eu.","Men's Socks","19.00 EUR","","Nike;Black;Basketball;in stock;No;Nike;Male|Female","","","","","","","","",""
"DN3314_100_S_CNF","","U nk evryday plus cush footie","http://ballzy.eu/et/product/u-nk-evryday-plus-cush-footie-dn3314-100-s-cnf","https://o.cropink.com/i/p-i/7d1048a5-4641-4403-8646-4e42bc9e8c28","","Spordiriided ballzy veebipoest. Vaata lähemalt ballzy.eu.","Men's Socks","19.00 EUR","","Nike;White;Basketball;in stock;No;Nike;Male|Female","","","","","","","","",""
"SX7669_100_S_CNF","","U nk everyday csh ankl 6pr 132","http://ballzy.eu/et/product/u-nk-everyday-csh-ankl-6pr-132-sx7669-100-s-cnf","https://o.cropink.com/i/p-i/90ca8616-0226-45a1-b539-5a211f100a30","","<html><body><p> mugavus ja tugevus&hellip; nike everyday cushioned sokid annavad jõudu treeningule. paks froteepõhi annab sulle lisamugavust jalaharjutuste ja tõstete tegemiseks, samas kui ribiline kaareriba ümbritseb sinu keskjalga, et tagada toetav tunne&hellip; toote omadused: dri-fit tehnoloogia aitab hoida jalad kuivana ja mugavalt&hellip; paks froteepõhi pakub mugavust ja löögiabi&hellip; ribitud kaareriba tagab toetava tunde&hellip; 1/4-pikkune siluett katab pahkluu&hellip; tooteomaduste  Vaata lähemalt ballzy.eu.","Men's Socks","19.00 EUR","","Nike;White;Basketball;in stock;No;Nike;Male|Female","","","","","","","","",""
"DH9081_010_S_CNF","","M j df sprt woven short","http://ballzy.eu/et/product/m-j-df-sprt-woven-short-dh9081-010-s-cnf","https://o.cropink.com/i/p-i/7075484e-d49b-415e-b4d7-3d5244f5346b","","Spordiriided ballzy veebipoest. Vaata lähemalt ballzy.eu.","Men's Shorts","39.00 EUR","19.00 EUR","Jordan;Black;Basketball;in stock;Yes;Jordan;Male","","","","","","","","",""
"DH8680_010_2XL_CNF","","Bkn m nk trkst cts ftpk","http://ballzy.eu/et/product/bkn-m-nk-trkst-cts-ftpk-dh8680-010-2xl-cnf","https://o.cropink.com/i/p-i/33b5160d-a0be-483c-a998-fbb2a240fdef","","Spordiriided ballzy veebipoest. Vaata lähemalt ballzy.eu.","Men's Pants","149.00 EUR","74.00 EUR","Nike;Black;Basketball;in stock;Yes;Nike;Male","","","","","","","","",""
"CV0062_010_MISC_CNF","","W nk one club bag","http://ballzy.eu/et/product/w-nk-one-club-bag-cv0062-010-misc-cnf","https://o.cropink.com/i/p-i/55b7a58c-aede-41ae-a587-98e678daa965","","sobib kõigeks./>nike one club spordikott hoiab kõik, mida vajate oma päeva jooksul lähedal ja korras. selles on ruumi joogamatile ning ventileeritud sahtel, mis hoiab teie jalanõud ja higised riided eraldi ülejäänud asjadest. see toode on valmistatud vähemalt 50% taaskasutatud polüestri kiududest.hoia eraldi - lukuga jalanõude sektsioon eraldab higised riided või jalanõud muudest varustusest, tagades hea ventilatsiooni hingavate silmustega.ruum kõigel Vaata lähemalt ballzy.eu.","Women's Bags","69.00 EUR","","Nike;Black;Basketball;in stock;No;Nike;Female","","","","","","","","",""
"DM1813_100_XS_CNF","","M j df sprt compression short","http://ballzy.eu/et/product/m-j-df-sprt-compression-short-dm1813-100-xs-cnf","https://o.cropink.com/i/p-i/4279655d-3cf6-41f5-8492-5068e9be09f8","","Toetage oma treeninguharjumust jordan brandi kompressioonipükstega. need on valmistatud paindlikust kootud kangast koos higi imava dri-fit tehnoloogiaga, mis tagab liibuva sobivuse, mille juures mugavust ei ohverdata.nike dri-fit tehnoloogia viib higi eemale nahalt kiirema aurustumise jaoks, aidates sul püsida kuivana ja mugavalt.veniv kootud kangas tagab liibuva ja toetava sobivuse.võrgumaterjalist paneelid külgedel tagavad hingavuse.libisemiskindel ta Vaata lähemalt ballzy.eu.","Men's Leggings","34.00 EUR","19.00 EUR","Jordan;White;Basketball;in stock;Yes;Jordan;Male","","","","","","","","",""
"77-204Z_CNF","","Tf-500 excel","http://ballzy.eu/et/product/tf-500-excel-77-204z-cnf","https://o.cropink.com/i/p-i/7c22cf1e-844d-4fbc-9011-0aaddf4d1612","","Spordiriided ballzy veebipoest. Vaata lähemalt ballzy.eu.","Kids' Basketballs","54.95 EUR","","Spalding;Multicolored;Basketball;in stock;No;Spalding;Male|Female|Children","","","","","","","","",""
"84-409Z_CNF","","Marble black/pink","http://ballzy.eu/et/product/marble-black-pink-84-409z-cnf","https://o.cropink.com/i/p-i/d3959fc1-efc4-4f77-9a8d-2c657d568861","","Spordiriided ballzy veebipoest. Vaata lähemalt ballzy.eu.","Kids' Basketballs","22.95 EUR","","Spalding;Multicolored;Basketball;in stock;No;Spalding;Male|Female|Children","","","","","","","","",""
"DM1827_010_XS_CNF","","M j df sprt slvls top","http://ballzy.eu/et/product/m-j-df-sprt-slvls-top-dm1827-010-xs-cnf","https://o.cropink.com/i/p-i/8a75c1ae-3a5d-4c17-8b91-842c0519c66b","","Ole valmis tegutsema. higi imava dri-fit tehnoloogia ja lõdva sobivusega on see varrukateta särk ideaalne treenimiseks ja visete sooritamiseks. mitmekülgne välimus ja tagasihoidlik bränding viivad sind väljakult diivanile ja kõikjale selle vahepeal.dri-fit tehnoloogia aitab hoida sind kuivana ja mugavalt.pesu efektiga kootud kangas tundub pehme ja kerge. Vaata lähemalt ballzy.eu.","Men's Tees","39.00 EUR","19.00 EUR","Jordan;Black;Basketball;in stock;Yes;Jordan;Male","","","","","","","","",""
"DM1827_100_S_CNF","","M j df sprt slvls top","http://ballzy.eu/et/product/m-j-df-sprt-slvls-top-dm1827-100-s-cnf","https://o.cropink.com/i/p-i/d702b062-e2de-4ad0-8331-c25d8487242e","","Spordiriided ballzy veebipoest. Vaata lähemalt ballzy.eu.","Men's Tees","39.00 EUR","19.00 EUR","Jordan;White;Basketball;in stock;Yes;Jordan;Male","","","","","","","","",""
"DD1919_068_S_CNF","","M np df 3qt tight","http://ballzy.eu/et/product/m-np-df-3qt-tight-dd1919-068-s-cnf","https://o.cropink.com/i/p-i/c26c183e-ff53-40fe-aa07-fec9e88daf8b","","<html><body><p> kerge tugevus, tugevus, mis on ette nähtud jõudluseks&hellip; nike pro dri-fit sukkpüksid ümbritsevad sind kerge kangaga, mis aitab sul tunda end kuivana, jahedana ja toetada sind alates soojendusest kuni jahedate treeninguteni. need on valmistatud vähemalt 75% ulatuses taaskasutatud polüesterkiududest, mille veniv disain aitab teil liikuda täie intensiivsusega ka kõige raskemate treeningute või võistluste ajal&hellip; toote omadused: need on valmistatud vähemalt 75% ulatuses taa Vaata lähemalt ballzy.eu.","Men's Leggings","49.00 EUR","","Nike;Gray;Basketball;in stock;No;Nike;Male","","","","","","","","",""
"DD1913_010_S_CNF","","M np df tight","http://ballzy.eu/et/product/m-np-df-tight-dd1913-010-s-cnf","https://o.cropink.com/i/p-i/a27a3937-ab7a-484b-b069-3e9efb09c0a2","","<html><body><p> kerge tugevus, tugevus, mis on ette nähtud jõudluseks&hellip; nike pro dri-fit sukkpüksid ümbritsevad sind kerge kangaga, mis aitab sul tunda end kuivana, jahedana ja toetab sind alates soojendusest kuni jahedate treeninguteni. need on valmistatud vähemalt 75% ulatuses taaskasutatud polüesterkiududest, mille veniv disain aitab teil liikuda täie intensiivsusega ka kõige raskemate treeningute või võistluste ajal&hellip; toote omadused: need on valmistatud vähemalt 75% ulatuses taas Vaata lähemalt ballzy.eu.","Men's Leggings","49.00 EUR","","Nike;Black;Basketball;in stock;No;Nike;Male","","","","","","","","",""
"DD1992_010_2XL_CNF","","M np df tight top ss","http://ballzy.eu/et/product/m-np-df-tight-top-ss-dd1992-010-2xl-cnf","https://o.cropink.com/i/p-i/30d7baab-5d5f-44ca-a916-31b8b64310e2","","<html><body><p> extra lhingavus, kuidas vaja on&hellip; nike pro dri-fit top on kergest riidest, mille hingavus on ehitatud soojuspiirkondadesse, et hoida sind jahedana ja kuivana alates soojendusest kuni jahtumiseni. veniv kangas, mis on valmistatud vähemalt 75% ulatuses taaskasutatud polüesterkiududest, on tiheda istuvusega, mis on hõlpsasti teiste topside all&hellip; toote omadused: nike dri-fit tehnoloogia viib higi nahast eemale, et see aurustuks kiiremini, aidates sul jääda kuivaks ja muga Vaata lähemalt ballzy.eu.","Men's Leggings","39.00 EUR","19.00 EUR","Nike;Black;Basketball;in stock;Yes;Nike;Male","","","","","","","","",""
"DD1992_100_S_CNF","","M np df tight top ss","http://ballzy.eu/et/product/m-np-df-tight-top-ss-dd1992-100-s-cnf","https://o.cropink.com/i/p-i/4d9fc1c5-d9f1-4acf-9c54-c92515be089c","","lisahingavus jus seal, kus seda kõige rohkem vajate./>nike pro dri-fit top ümbritseb teid kergest kangast, millel on sisseehitatud hingavus kuumades piirkondades, aidates teil püsida jahedana ja kuivana soojendusperioodidest kuni jahtumiseni. veniv kangas, mis on valmistatud vähemalt 75% taaskasutatud polüesterkiududest, on kitsa sobivusega ja saab lihtsasti kanda teiste pealispükste all.sisseehitatud hingavus - võrkmaterjal suure soojuskoormusega piirkondades na Vaata lähemalt ballzy.eu.","Men's Leggings","39.00 EUR","19.00 EUR","Nike;White;Basketball;in stock;Yes;Nike;Male","","","","","","","","",""
"DQ4870_010_S_CNF","","M np df warm tght","http://ballzy.eu/et/product/m-np-df-warm-tght-dq4870-010-s-cnf","https://o.cropink.com/i/p-i/1588a88c-7b5c-4e1e-8f91-25d3a057b2ff","","Spordiriided ballzy veebipoest. Vaata lähemalt ballzy.eu.","Men's Leggings","59.00 EUR","29.00 EUR","Nike;Black;Basketball;in stock;Yes;Nike;Male","","","","","","","","",""
"NKN03_100_1SIZE_CNF","","Nike wristbands nba 2 pk","http://ballzy.eu/et/product/nike-wristbands-nba-2-pk-nkn03-100-1size-cnf","https://o.cropink.com/i/p-i/218b8acc-da69-49a9-b49e-4c4afa60a34d","","Spordiriided ballzy veebipoest. Vaata lähemalt ballzy.eu.","Kids' Accessories","19.00 EUR","10.00 EUR","Nike;White;Basketball;in stock;Yes;Nike;Male|Female|Children","","","","","","","","",""
"DD1988_100_S_CNF","","M np df top sl tight","http://ballzy.eu/et/product/m-np-df-top-sl-tight-dd1988-100-s-cnf","https://o.cropink.com/i/p-i/ceef9ba1-e493-4930-874a-1c979f876b89","","Spordiriided ballzy veebipoest. Vaata lähemalt ballzy.eu.","Men's Leggings","39.00 EUR","29.00 EUR","Nike;White;Basketball;in stock;Yes;Nike;Male","","","","","","","","",""
"UJ0009_001_5-7_CNF","","Jhn jordan jumpman quarter","http://ballzy.eu/et/product/jhn-jordan-jumpman-quarter-uj0009-001-5-7-cnf","https://o.cropink.com/i/p-i/e311360a-986b-466f-aca4-d4a37221e717","","Spordiriided ballzy veebipoest. Vaata lähemalt ballzy.eu.","Kids' Socks","19.00 EUR","7.00 EUR","Jordan;White;Basketball;in stock;Yes;Jordan;Children","","","","","","","","",""
