"ID","ID2","Item title","Final URL","Image URL","Item subtitle","Item description","Item category","Price","Sale price","Contextual keywords","Item address","Tracking template","Custom parameter","Final mobile URL","Android app link","iOS app link","iOS app store ID","Formatted price","Formatted sale price"
"SX7622_013_S_CNF","","U nk elite crew 132","http://ballzy.eu/et/product/u-nk-elite-crew-132-sx7622-013-s-cnf","http://backend.ballzy.eu/media/catalog/product/u/m/ummdr2suf43ww9h7kw.jpg","","Nike elite crew' korvpallisokid toetavad tänu võlviribale jalga ja pehmendused strateegilistes kohtades summutavad põrutust, kui sa üle väljaku jooksed. dri-fit-i tehnoloogia aitab sul püsida kuiv ja tunda end mugavalt. Vaata lähemalt ballzy.eu.","Men's Socks","14.00 EUR","11.20 EUR","Nike;Black;Basketball;in stock;Yes;Nike;Male|Female|Children","","","","","","","","",""
"6446B_BLK_S_CNF","","Mcd extended leg sleeves","http://ballzy.eu/et/product/mcd-extended-leg-sleeves-6446b-blk-s-cnf","http://backend.ballzy.eu/media/catalog/product/a/i/ai4oo7ttg8buz364hy.jpg","","Leg sleeve featuring 9mm hex™ technology is a favorite among pro and collegiate players Vaata lähemalt ballzy.eu.","Kids' Accessories","49.00 EUR","29.00 EUR","Mcdavid;Black;Basketball;in stock;Yes;Mcdavid;Male|Female|Children","","","","","","","","",""
"6446W_WHI_S_CNF","","Mcd extended leg sleeves","http://ballzy.eu/et/product/mcd-extended-leg-sleeves-6446w-whi-s-cnf","http://backend.ballzy.eu/media/catalog/product/9/2/92z3xekzasutqqu02ricw.jpg","","Leg sleeve featuring 9mm hex™ technology is a favorite among pro and collegiate players Vaata lähemalt ballzy.eu.","Kids' Accessories","49.00 EUR","19.00 EUR","Mcdavid;White;Basketball;in stock;Yes;Mcdavid;Male|Female|Children","","","","","","","","",""
"6500B_BLK_S_CNF","","Mcd hex shooter arm sleeve","http://ballzy.eu/et/product/mcd-hex-shooter-arm-sleeve-6500b-blk-s-cnf","http://backend.ballzy.eu/media/catalog/product/r/2/r2bhzk2v8mouymq.jpg","","Arm compression maintains muscle warmth and prevents abrasions and scratches Vaata lähemalt ballzy.eu.","Kids' Accessories","24.00 EUR","14.00 EUR","Mcdavid;Black;Basketball;in stock;Yes;Mcdavid;Male|Female|Children","","","","","","","","",""
"6500S_BLU_S_CNF","","Mcd hex shooter arm sleeve","http://ballzy.eu/et/product/mcd-hex-shooter-arm-sleeve-6500s-blu-s-cnf","http://backend.ballzy.eu/media/catalog/product/x/n/xnoe5fx9szm6sa84.jpg","","Arm compression maintains muscle warmth and prevents abrasions and scratches Vaata lähemalt ballzy.eu.","Kids' Accessories","24.00 EUR","14.00 EUR","Mcdavid;Blue;Basketball;in stock;Yes;Mcdavid;Male|Female|Children","","","","","","","","",""
"300207401_S_CNF","","Spalding parka","http://ballzy.eu/et/product/spalding-parka-300207401-s-cnf","http://backend.ballzy.eu/media/catalog/product/9/u/9u4j8byc3qd4t3a6v.jpg","","Spordiriided ballzy veebipoest. Vaata lähemalt ballzy.eu.","Men's Jackets","140.00 EUR","112.00 EUR","Spalding;Black;Basketball;in stock;Yes;Spalding;Male","","","","","","","","",""
"EW7100A_BLUE_33_CNF","","Basketball shoe jr","http://ballzy.eu/et/product/basketball-shoe-jr-ew7100a-blue-33-cnf","http://backend.ballzy.eu/media/catalog/product/c/7/c7rpgfxqvg688pznykhd9.jpg","","Spordiriided ballzy veebipoest. Vaata lähemalt ballzy.eu.","Kids' Basketball Shoes","59.00 EUR","24.00 EUR","Peak;Black;Basketball;in stock;Yes;Peak;Children","","","","","","","","",""
"6500W_WHI_S_CNF","","Mcd hex shooter arm sleeve","http://ballzy.eu/et/product/mcd-hex-shooter-arm-sleeve-6500w-whi-s-cnf","http://backend.ballzy.eu/media/catalog/product/6/5/6500w_whi_s_1.jpg","","Arm compression maintains muscle warmth and prevents abrasions and scratches Vaata lähemalt ballzy.eu.","Kids' Accessories","24.00 EUR","14.00 EUR","Mcdavid;White;Basketball;in stock;Yes;Mcdavid;Male|Female|Children","","","","","","","","",""
"SX7667_100_S_CNF","","U nk everyday cush ankle 3pr","http://ballzy.eu/et/product/u-nk-everyday-cush-ankle-3pr-sx7667-100-s-cnf","http://backend.ballzy.eu/media/catalog/product/s/x/sx7667_100_s_1.jpg","","mugavus ja toestus./>läbi oma treeningud nike everyday cushioned socks sokkidega. paks terry tallaosa annab sulle lisamugavust jalgade harjutuste ja tõstete jaoks, samal ajal kui võlvi ümber on liibuv ja toetav riba ekstrateotuse jaoks.dri-fit tehnoloogia aitab hoida su jalad kuivana ja mugavana.paks terry tallaosa pakub mugavust ja põrutuse neeldumist.võlvi ümber olev riba annab toetava tunde.1/4-pikkusega lõige katab su pahkluu. Vaata lähemalt ballzy.eu.","Men's Socks","19.00 EUR","15.20 EUR","Nike;White;Basketball;in stock;Yes;Nike;Male|Female|Children","","","","","","","","",""
"SX5854_010_S_CNF","","U j flight crew","http://ballzy.eu/et/product/u-j-flight-crew-sx5854-010-s-cnf","http://backend.ballzy.eu/media/catalog/product/j/o/jordan-u-j-flight-crew-must-kvqa.jpg","","<html><body><p> sneaker's best friend&hellip; jordan flight crew sokid toovad tulemusliku korvpalli eelised sinu sokisahtlisse. need on mugavad, venivad ja pehmed, sisseehitatud pehmendusega ja hingavusega. higi ärajuhtiv tehnoloogia aitab hoida jalad liikvel olles mugavalt &hellip; toote omadused: pehme, veniv trikookangas pakub mugavat ja mugavat istuvust&hellip; sissekootud pehmendus aitab jalga pehmendada olulistes kohtades&hellip; sissekootud võrk tagab hingavuse&hellip; kaaristuge venib ja Vaata lähemalt ballzy.eu.","Men's Socks","17.00 EUR","10.00 EUR","Jordan;Black;Basketball;in stock;Yes;Jordan;Male","","","","","","","","",""
"SK0110_101_S_CNF","","U nk nsw evry essential ankle","http://ballzy.eu/et/product/u-nk-nsw-evry-essential-ankle-sk0110-101-s-cnf","http://backend.ballzy.eu/media/catalog/product/n/i/nike-u-nk-nsw-evry-essential-ankle-valge-f5dl.jpg","","Spordiriided ballzy veebipoest. Vaata lähemalt ballzy.eu.","Men's Socks","17.00 EUR","12.00 EUR","Nike;White;Basketball;in stock;Yes;Nike;Male|Female|Children","","","","","","","","",""
"SX7666_100_M_CNF","","U nk everyday cush crew 6 pairs","http://ballzy.eu/et/product/u-nk-everyday-cush-crew-6-pairs-sx7666-100-m-cnf","http://backend.ballzy.eu/media/catalog/product/n/i/nike-u-nk-everyday-cush-crew-6-pairs-valge-ubzb.jpg","","<html><body><p> mugavus ja tugevus&hellip; nike everyday cushioned sokid annavad jõudu treeningule. paks froteepõhi annab sulle lisamugavust jalaharjutuste ja tõstete tegemiseks, samas kui ribiline kaareriba ümbritseb sinu keskjalga, et tagada toetav tunne&hellip; toote omadused: dri-fit tehnoloogia aitab hoida jalad kuivana ja mugavalt&hellip; paks froteepõhi pakub mugavust ja löögiabi&hellip; ribitud kaareriba pakub toetavat tunnet&hellip; crew-siluett katab pahkluu ja alajäseme&hellip; tooteo Vaata lähemalt ballzy.eu.","Men's Socks","29.00 EUR","23.20 EUR","Nike;White;Basketball;in stock;Yes;Nike;Male|Female|Children","","","","","","","","",""
"SX7589_010_M_CNF","","U jordan crew - nba","http://ballzy.eu/et/product/u-jordan-crew-nba-sx7589-010-m-cnf","http://backend.ballzy.eu/media/catalog/product/j/o/jordan-u-jordan-crew-nba-must-vcqj.jpg","","<html><body><p> focused footwork: nba edition&hellip; jordan nba crew sokid pakuvad toetavat istuvust ja tunnetust. ümbritsev kaareriba haarab jalga, samal ajal kui tsooniline pehmendus aitab põrutusi neelata, kui jooksete väljakul&hellip; toote omadused: zonaalne pehmendus aitab absorbeerida lööki&hellip; kaarepael pakub mugavat ja turvalist istuvust&hellip; toote omaduste alapealkirjad: higi eemaldav tehnoloogia aitab sul kuivana ja mugavalt püsida&hellip; toote omaduste alapealkirjad: higi ee Vaata lähemalt ballzy.eu.","Men's Socks","24.00 EUR","19.20 EUR","Jordan;Black;Basketball;in stock;Yes;Jordan;Male|Female|Children","","","","","","","","",""
"8235SCN_CNF","","Net heavy duty","http://ballzy.eu/et/product/net-heavy-duty-8235scn-cnf","http://backend.ballzy.eu/media/catalog/product/s/p/spalding-net-heavy-duty-multicolor-umdy.jpg","","Spordiriided ballzy veebipoest. Vaata lähemalt ballzy.eu.","Kids' Accessories","11.00 EUR","8.80 EUR","Spalding;Multicolored;Basketball;in stock;Yes;Spalding;Male|Female|Children","","","","","","","","",""
"20955HN_99_XS_CNF","","Hnmky bomber jacket black","http://ballzy.eu/et/product/hnmky-bomber-jacket-black-20955hn-99-xs-cnf","http://backend.ballzy.eu/media/catalog/product/b/a/ballzy-fanwear-hnmky-bomber-jacket-black-must-pqkk.jpg","","Spordiriided ballzy veebipoest. Vaata lähemalt ballzy.eu.","Men's Jackets","100.00 EUR","80.00 EUR","Ballzy Fanwear;Black;Basketball;in stock;Yes;Ballzy Fanwear;Male|Female|Children","","","","","","","","",""
"6446R_RED_S_CNF","","Mcd extended leg sleeves","http://ballzy.eu/et/product/mcd-extended-leg-sleeves-6446r-red-s-cnf","http://backend.ballzy.eu/media/catalog/product/m/c/mcdavid-mcd-extended-leg-sleeves-punane-sfwl.jpg","","Leg sleeve featuring 9mm hex™ technology is a favorite among pro and collegiate players Vaata lähemalt ballzy.eu.","Kids' Accessories","39.00 EUR","19.00 EUR","Mcdavid;Red;Basketball;in stock;Yes;Mcdavid;Male|Female|Children","","","","","","","","",""
"DD1917_010_S_CNF","","M np df short","http://ballzy.eu/et/product/m-np-df-short-dd1917-010-s-cnf","http://backend.ballzy.eu/media/catalog/product/n/i/nike-m-np-df-short-must-f9ag.jpg","","<html><body><p> kerge tugevus, tugevus, mis on ette nähtud jõudluseks&hellip; nike pro dri-fit shorts on palju rohkem kui põhikiht, sest need on kergest materjalist, mis hoiab sind kuivana, jahedana ja toetab sind alates soojendusest kuni jahedate treeninguteni. need on valmistatud vähemalt 75% ulatuses taaskasutatud polüesterkiududest, mille veniv disain aitab sul kõige raskemate treeningute või võistluste ajal täiel määral liikuda&hellip; tooteomadused: nike dri-fit tehnoloogia juhib higi keha Vaata lähemalt ballzy.eu.","Men's Leggings","34.00 EUR","24.00 EUR","Nike;Black;Basketball;in stock;Yes;Nike;Male","","","","","","","","",""
"DD1917_068_S_CNF","","M np df short","http://ballzy.eu/et/product/m-np-df-short-dd1917-068-s-cnf","http://backend.ballzy.eu/media/catalog/product/n/i/nike-m-np-df-short-hall-ncur.jpg","","<html><body><p> kerge tugevus, tugevus, mis on ette nähtud jõudluseks&hellip; nike pro dri-fit shorts on palju rohkem kui põhikiht, sest need on kergest materjalist, mis hoiab sind kuivana, jahedana ja toetab sind alates soojendusest kuni jahedate treeninguteni. need on valmistatud vähemalt 75% ulatuses taaskasutatud polüesterkiududest, mille veniv disain aitab sul kõige raskemate treeningute või võistluste ajal täiel määral liikuda&hellip; tooteomadused: nike dri-fit tehnoloogia juhib higi keha Vaata lähemalt ballzy.eu.","Men's Leggings","34.00 EUR","24.00 EUR","Nike;Gray;Basketball;in stock;Yes;Nike;Male","","","","","","","","",""
"DD1917_100_S_CNF","","M np df short","http://ballzy.eu/et/product/m-np-df-short-dd1917-100-s-cnf","http://backend.ballzy.eu/media/catalog/product/n/i/nike-m-np-df-short-valge-c3vx.jpg","","<html><body><p> kerge tugevus, tugevus, mis on ette nähtud jõudluseks&hellip; nike pro dri-fit shorts on palju rohkem kui põhikiht, sest need on kergest materjalist, mis hoiab sind kuivana, jahedana ja toetab sind alates soojendusest kuni jahedate treeninguteni. need on valmistatud vähemalt 75% ulatuses taaskasutatud polüesterkiududest, mille veniv disain aitab sul kõige raskemate treeningute või võistluste ajal täiel määral liikuda&hellip; tooteomadused: nike dri-fit tehnoloogia juhib higi keha Vaata lähemalt ballzy.eu.","Men's Leggings","34.00 EUR","23.00 EUR","Nike;White;Basketball;in stock;Yes;Nike;Male","","","","","","","","",""
"DD1919_010_S_CNF","","M np df 3qt tight","http://ballzy.eu/et/product/m-np-df-3qt-tight-dd1919-010-s-cnf","http://backend.ballzy.eu/media/catalog/product/n/i/nike-m-np-df-3qt-tight-must-naib.jpg","","<html><body><p> kerge tugevus, tugevus, mis on ette nähtud jõudluseks&hellip; nike pro dri-fit sukkpüksid ümbritsevad sind kerge kangaga, mis aitab sul tunda end kuivana, jahedana ja toetada sind alates soojendusest kuni jahedate treeninguteni. need on valmistatud vähemalt 75% ulatuses taaskasutatud polüesterkiududest, mille veniv disain aitab teil liikuda täie intensiivsusega ka kõige raskemate treeningute või võistluste ajal&hellip; toote omadused: need on valmistatud vähemalt 75% ulatuses taa Vaata lähemalt ballzy.eu.","Men's Leggings","39.00 EUR","31.20 EUR","Nike;Black;Basketball;in stock;Yes;Nike;Male","","","","","","","","",""
"DH5485_601_S_CNF","","U nk everyday ankle 1pk - 144","http://ballzy.eu/et/product/u-nk-everyday-ankle-1pk-144-dh5485-601-s-cnf","http://backend.ballzy.eu/media/catalog/product/n/i/nike-u-nk-everyday-ankle-1pk-144-roosa-gf9w.jpg","","<html><body><p> töötavad välja rõveduse pärast. kombineerides pehmed lõngad higi äravoolava võimsusega, aitavad need narmastatud mansetiga sokid hoida jalad treeningute ajal kuivana ja mugavalt, ohverdamata seejuures stiili&hellip; tooteomadused: dri-fit tehnoloogia aitab hoida jalad kuivana ja mugavalt&hellip; kootud lõngad tunduvad jalgade vastu pehmed&hellip; toote omaduste alajaotused: tootedetailid: 85% polüester/13% nailon/2% elastaani&hellip; masinpesu. imporditud. </p></body></html> Vaata lähemalt ballzy.eu.","Men's Socks","17.00 EUR","8.00 EUR","Nike;Pink;Basketball;in stock;Yes;Nike;Male|Female","","","","","","","","",""
"DH5485_010_S_CNF","","U nk everyday ankle 1pk - 144","http://ballzy.eu/et/product/u-nk-everyday-ankle-1pk-144-dh5485-010-s-cnf","http://backend.ballzy.eu/media/catalog/product/n/i/nike-u-nk-everyday-ankle-1pk-144-must-erfe.jpg","","<html><body><p> töötavad välja rõveduse pärast. kombineerides pehmed lõngad higi äravoolava võimsusega, aitavad need narmastatud mansetiga sokid hoida jalad treeningute ajal kuivana ja mugavalt, ohverdamata seejuures stiili&hellip; tooteomadused: dri-fit tehnoloogia aitab hoida jalad kuivana ja mugavalt&hellip; kootud lõngad tunduvad jalgade vastu pehmed&hellip; toote omaduste alajaotused: tootedetailid: 85% polüester/13% nailon/2% elastaani&hellip; masinpesu. imporditud. </p></body></html> Vaata lähemalt ballzy.eu.","Men's Socks","17.00 EUR","9.00 EUR","Nike;Black;Basketball;in stock;Yes;Nike;Male|Female","","","","","","","","",""
"DN3314_010_S_CNF","","U nk evryday plus cush footie","http://ballzy.eu/et/product/u-nk-evryday-plus-cush-footie-dn3314-010-s-cnf","http://backend.ballzy.eu/media/catalog/product/n/i/nike-u-nk-evryday-plus-cush-footie-must-i0uf.jpg","","Spordiriided ballzy veebipoest. Vaata lähemalt ballzy.eu.","Men's Socks","19.00 EUR","15.20 EUR","Nike;Black;Basketball;in stock;Yes;Nike;Male|Female","","","","","","","","",""
"DN3314_100_S_CNF","","U nk evryday plus cush footie","http://ballzy.eu/et/product/u-nk-evryday-plus-cush-footie-dn3314-100-s-cnf","http://backend.ballzy.eu/media/catalog/product/n/i/nike-u-nk-evryday-plus-cush-footie-valge-hbij.jpg","","Spordiriided ballzy veebipoest. Vaata lähemalt ballzy.eu.","Men's Socks","19.00 EUR","15.20 EUR","Nike;White;Basketball;in stock;Yes;Nike;Male|Female","","","","","","","","",""
"SX7669_100_S_CNF","","U nk everyday csh ankl 6pr 132","http://ballzy.eu/et/product/u-nk-everyday-csh-ankl-6pr-132-sx7669-100-s-cnf","http://backend.ballzy.eu/media/catalog/product/n/i/nike-u-nk-everyday-csh-ankl-6pr-132-valge-hevk.jpg","","<html><body><p> mugavus ja tugevus&hellip; nike everyday cushioned sokid annavad jõudu treeningule. paks froteepõhi annab sulle lisamugavust jalaharjutuste ja tõstete tegemiseks, samas kui ribiline kaareriba ümbritseb sinu keskjalga, et tagada toetav tunne&hellip; toote omadused: dri-fit tehnoloogia aitab hoida jalad kuivana ja mugavalt&hellip; paks froteepõhi pakub mugavust ja löögiabi&hellip; ribitud kaareriba tagab toetava tunde&hellip; 1/4-pikkune siluett katab pahkluu&hellip; tooteomaduste  Vaata lähemalt ballzy.eu.","Men's Socks","19.00 EUR","15.20 EUR","Nike;White;Basketball;in stock;Yes;Nike;Male|Female","","","","","","","","",""
"CV0062_010_MISC_CNF","","W nk one club bag","http://ballzy.eu/et/product/w-nk-one-club-bag-cv0062-010-misc-cnf","http://backend.ballzy.eu/media/catalog/product/n/i/nike-w-nk-one-club-bag-must-gczm.jpg","","sobib kõigeks./>nike one club spordikott hoiab kõik, mida vajate oma päeva jooksul lähedal ja korras. selles on ruumi joogamatile ning ventileeritud sahtel, mis hoiab teie jalanõud ja higised riided eraldi ülejäänud asjadest. see toode on valmistatud vähemalt 50% taaskasutatud polüestri kiududest.hoia eraldi - lukuga jalanõude sektsioon eraldab higised riided või jalanõud muudest varustusest, tagades hea ventilatsiooni hingavate silmustega.ruum kõigel Vaata lähemalt ballzy.eu.","Women's Bags","69.00 EUR","55.20 EUR","Nike;Black;Basketball;in stock;Yes;Nike;Female","","","","","","","","",""
"77-204Z_CNF","","Tf-500 excel","http://ballzy.eu/et/product/tf-500-excel-77-204z-cnf","http://backend.ballzy.eu/media/catalog/product/s/p/spalding-tf-500-excel-multicolor-xqxx.jpg","","Spordiriided ballzy veebipoest. Vaata lähemalt ballzy.eu.","Kids' Basketballs","54.95 EUR","43.96 EUR","Spalding;Multicolored;Basketball;in stock;Yes;Spalding;Male|Female|Children","","","","","","","","",""
"DD1913_010_S_CNF","","M np df tight","http://ballzy.eu/et/product/m-np-df-tight-dd1913-010-s-cnf","http://backend.ballzy.eu/media/catalog/product/n/i/nike-m-np-df-tight-must-gpqm.jpg","","<html><body><p> kerge tugevus, tugevus, mis on ette nähtud jõudluseks&hellip; nike pro dri-fit sukkpüksid ümbritsevad sind kerge kangaga, mis aitab sul tunda end kuivana, jahedana ja toetab sind alates soojendusest kuni jahedate treeninguteni. need on valmistatud vähemalt 75% ulatuses taaskasutatud polüesterkiududest, mille veniv disain aitab teil liikuda täie intensiivsusega ka kõige raskemate treeningute või võistluste ajal&hellip; toote omadused: need on valmistatud vähemalt 75% ulatuses taas Vaata lähemalt ballzy.eu.","Men's Leggings","49.00 EUR","39.20 EUR","Nike;Black;Basketball;in stock;Yes;Nike;Male","","","","","","","","",""
"UJ0009_001_5-7_CNF","","Jhn jordan jumpman quarter","http://ballzy.eu/et/product/jhn-jordan-jumpman-quarter-uj0009-001-5-7-cnf","http://backend.ballzy.eu/media/catalog/product/j/o/jordan-jhn-jordan-jumpman-quarter-valge-hb7k.jpg","","Spordiriided ballzy veebipoest. Vaata lähemalt ballzy.eu.","Kids' Socks","19.00 EUR","10.00 EUR","Jordan;White;Basketball;in stock;Yes;Jordan;Children","","","","","","","","",""
"NJ0362_R78_6-12_CNF","","Jordan legacy infant/toddler a","http://ballzy.eu/et/product/jordan-legacy-infant-toddler-a-nj0362-r78-6-12-cnf","http://backend.ballzy.eu/media/catalog/product/j/o/jordan-jordan-legacy-infant-toddler-a-multicolor-yncr.jpg","","Spordiriided ballzy veebipoest. Vaata lähemalt ballzy.eu.","Kids' Socks","19.00 EUR","10.00 EUR","Jordan;Multicolored;Basketball;in stock;Yes;Jordan;Children","","","","","","","","",""
"N100408687807_7_CNF","","Nike elite championship 8p 2.0","http://ballzy.eu/et/product/nike-elite-championship-8p-2-0-n100408687807-7-cnf","http://backend.ballzy.eu/media/catalog/product/j/o/jordan-nike-elite-championship-8p-2-0-oran-kiap.jpg","","Spordiriided ballzy veebipoest. Vaata lähemalt ballzy.eu.","Kids' Basketballs","84.00 EUR","67.20 EUR","Nike;Orange;Basketball;in stock;Yes;Nike;Male|Female|Children","","","","","","","","",""
"DD1988_068_S_CNF","","M np df top sl tight","http://ballzy.eu/et/product/m-np-df-top-sl-tight-dd1988-068-s-cnf","http://backend.ballzy.eu/media/catalog/product/n/i/nike-m-np-df-top-sl-tight-hall-coyc.jpg","","Spordiriided ballzy veebipoest. Vaata lähemalt ballzy.eu.","Men's Leggings","39.00 EUR","22.00 EUR","Nike;Gray;Basketball;in stock;Yes;Nike;Male","","","","","","","","",""
"N1004369_070_7_CNF","","Nike everyday all court 8p","http://ballzy.eu/et/product/nike-everyday-all-court-8p-n1004369-070-7-cnf","http://backend.ballzy.eu/media/catalog/product/n/i/nike-nike-everyday-all-court-8p-must-p7un.jpg","","Spordiriided ballzy veebipoest. Vaata lähemalt ballzy.eu.","Kids' Basketballs","39.00 EUR","19.00 EUR","Nike;Black;Basketball;in stock;Yes;Nike;Male|Female|Children","","","","","","","","",""
"N1007493_010_1SIZE_CNF","","Nike swoosh scarf 2.0 sail/pin","http://ballzy.eu/et/product/nike-swoosh-scarf-2-0-sail-pin-n1007493-010-1size-cnf","http://backend.ballzy.eu/media/catalog/product/j/o/jordan-nike-swoosh-scarf-2-0-sail-pin-must-cgna.jpg","","Spordiriided ballzy veebipoest. Vaata lähemalt ballzy.eu.","Kids' Accessories","34.00 EUR","19.00 EUR","Nike;Black;Basketball;in stock;Yes;Nike;Male|Female|Children","","","","","","","","",""
"DN3314_063_S_CNF","","U nk evryday plus cush footie","http://ballzy.eu/et/product/u-nk-evryday-plus-cush-footie-dn3314-063-s-cnf","http://backend.ballzy.eu/media/catalog/product/n/i/nike-u-nk-evryday-plus-cush-footie-hall-snpb.jpg","","Spordiriided ballzy veebipoest. Vaata lähemalt ballzy.eu.","Men's Socks","19.00 EUR","10.00 EUR","Nike;Gray;Basketball;in stock;Yes;Nike;Male|Female|Children","","","","","","","","",""
"GX6886_7_CNF","","D.o.n. issue 4","http://ballzy.eu/et/product/d-o-n-issue-4-gx6886-7-cnf","http://backend.ballzy.eu/media/catalog/product/a/d/adidas-performance-d-o-n-issue-4-hall-yi71.jpg","","<html><body><p> korvpalli tulevik seisnebki kiiruses ja donovan mitchell on väga kiire. need mitchelli ja adidas basketi allkirjastatud kingad on loodud spetsiaalselt selleks, et tõsta ühe mängu kiireima ja dünaamilisema skooreri liikumist. ultralight lightstrike ühendab lightlocki pealse, mis tagab mugava istuvuse ja liikumissüsteemi, mis ei kaalu sind. ainulaadne kummist välistald on loodud tekitama haardumist seal, kus seda kõige rohkem vajate, nii et iga kõva lõikuse ja peapöörde puhul on tä Vaata lähemalt ballzy.eu.","Men's Basketball Shoes","139.00 EUR","59.00 EUR","adidas Performance;Gray;Basketball;in stock;Yes;adidas Performance;Male","","","","","","","","",""
"DX9656_100_S_CNF","","U j everyday cush poly ns 3pr","http://ballzy.eu/et/product/u-j-everyday-cush-poly-ns-3pr-dx9656-100-s-cnf","http://backend.ballzy.eu/media/catalog/product/j/o/jordan-u-j-everyday-cush-poly-ns-3pr-valge-vbqn.jpg","","<html><body><p> lisage oma stiilile mugavust nende mittesoovitavate sokkidega. higi ärajuhtiv jõud ja hingavus aitavad hoida jalad kuivana ja jahedana, et saaksite oma päeva täie jõuga läbi suruda&hellip; toote omadused: dri-fit tehnoloogia aitab teie jalgadel kuivana ja mugavalt püsida&hellip; pehmendus esijalal ja kannal aitab pehmendada treeningu mõju&hellip; kaarepiirkonna ümber olev rihm on mugav ja toetav&hellip; hingav kudumismuster ülaosas lisab ventilatsiooni&hellip; tugevdatud kanna ja Vaata lähemalt ballzy.eu.","Men's Socks","19.00 EUR","10.00 EUR","Jordan;White;Basketball;in stock;Yes;Jordan;Male|Female|Children","","","","","","","","",""
"GZ2013_4_CNF","","Harden vol. 6 j","http://ballzy.eu/et/product/harden-vol-6-j-gz2013-4-cnf","http://backend.ballzy.eu/media/catalog/product/a/d/adidas-performance-harden-vol-6-j-kollane-tvef.jpg","","<html><body><p> löö siis, kui su vastane seda kõige vähem ootab. sõida ääreni, tõmba sügavalt ja jäta kaitsjad maha - täpselt nagu james harden. need juunioride adidas korvpallijalatsid on valmistatud boostiga, mis annab sulle vajalikku energiat alates avavilest kuni lisaaja viimaste sekunditeni. esijalal ja kannal olevad paelad annavad sulle kogu mängu vältel kindla tunnetuse.  valmistatud osaliselt ringlussevõetud materjalist, mis on saadud tootmisjäätmetest, nt lõikamisjäätmetest, ja tarbimis Vaata lähemalt ballzy.eu.","Kids' Basketball Shoes","149.00 EUR","69.00 EUR","adidas Performance;Yellow;Basketball;in stock;Yes;adidas Performance;Children","","","","","","","","",""
"HBKB3475_HEAT_S_CNF","","Mitchell  &amp; ness miami heat lifestyle reversible bucket","http://ballzy.eu/et/product/mitchell-ness-miami-heat-lifestyle-reversible-bucket-hbkb3475-heat-s-cnf","http://backend.ballzy.eu/media/catalog/product/m/i/mitchell-and-ness-mitchell-ness-miami-heat-lifestyle-reversible-bucket-must-rgk4.jpg","","Spordiriided ballzy veebipoest. Vaata lähemalt ballzy.eu.","Men's Hats","29.00 EUR","10.00 EUR","Mitchell &amp; Ness;Black;Basketball;in stock;Yes;Mitchell and Ness;Male","","","","","","","","",""
"AO8662_010_MISC_CNF","","W nsw h86 futura classic cap","http://ballzy.eu/et/product/w-nsw-h86-futura-classic-cap-ao8662-010-misc-cnf","http://backend.ballzy.eu/media/catalog/product/n/i/nike-w-nsw-h86-futura-classic-cap-must-9owc.jpg","","Spordiriided ballzy veebipoest. Vaata lähemalt ballzy.eu.","Women's Hats","29.00 EUR","16.00 EUR","Nike;Black;Basketball;in stock;Yes;Nike;Female","","","","","","","","",""
"DX9655_010_S_CNF","","U j ed cush poly ankle 3pr 144","http://ballzy.eu/et/product/u-j-ed-cush-poly-ankle-3pr-144-dx9655-010-s-cnf","http://backend.ballzy.eu/media/catalog/product/j/o/jordan-u-j-ed-cush-poly-ankle-3pr-144-must-sxtu.jpg","","Need madalad õhku läbilaskvate paneelide ja higi ära juhtiva tehnoloogiaga sokid hoiavad jalad kuivad ja jahutatud. võlvi ümber mõnusalt liibuvad sokid toestavad jalga. Vaata lähemalt ballzy.eu.","Men's Socks","24.00 EUR","19.20 EUR","Jordan;Black;Basketball;in stock;Yes;Jordan;Male|Female|Children","","","","","","","","",""
